[
  { "id": "bamako_mopti", "a": "bamako", "b": "mopti",
    "types": ["road"], "capacity": 0.7,
    "notes": "RN6 corridor; state logistics and infiltration share the road." },
  { "id": "mopti_gao", "a": "mopti", "b": "gao",
    "types": ["road", "river", "smuggling"], "capacity": 0.6,
    "notes": "Niger river axis — the 2013 intervention's route, and the rollback's." },
  { "id": "gao_kidal", "a": "gao", "b": "kidal",
    "types": ["road", "smuggling", "ethnic"], "capacity": 0.5,
    "notes": "Desert route to the Tuareg heartland; 2011 Libya arms flow." },
  { "id": "gao_menaka", "a": "gao", "b": "menaka",
    "types": ["road", "smuggling"], "capacity": 0.55,
    "notes": "Eastward along the bend." },
  { "id": "kidal_menaka", "a": "kidal", "b": "menaka",
    "types": ["smuggling", "ethnic"], "capacity": 0.45,
    "notes": "Intra-Tuareg corridor." },
  { "id": "menaka_tillaberi", "a": "menaka", "b": "tillaberi",
    "types": ["border", "smuggling", "ethnic"], "capacity": 0.55,
    "notes": "The corridor into the tri-border zone — the franchise's main artery in the historical run." },
  { "id": "gao_tillaberi", "a": "gao", "b": "tillaberi",
    "types": ["border", "smuggling"], "capacity": 0.6,
    "notes": "Tri-border artery, Mali side." },
  { "id": "mopti_sahel_bf", "a": "mopti", "b": "sahel_bf",
    "types": ["border", "ethnic", "smuggling"], "capacity": 0.55,
    "notes": "The 2015+ spillover path into Soum/Djibo — cross-border community ties." },
  { "id": "sahel_bf_ouagadougou", "a": "sahel_bf", "b": "ouagadougou",
    "types": ["road"], "capacity": 0.6,
    "notes": "Djibo road; in the bad years, a convoy route under escort." },
  { "id": "sahel_bf_tillaberi", "a": "sahel_bf", "b": "tillaberi",
    "types": ["border", "smuggling"], "capacity": 0.5,
    "notes": "Tri-border artery, Burkina side." },
  { "id": "bamako_ouagadougou", "a": "bamako", "b": "ouagadougou",
    "types": ["road"], "capacity": 0.65,
    "notes": "Inter-capital highway; the axis the coup cascade and the AES propagated along." },
  { "id": "ouagadougou_tillaberi", "a": "ouagadougou", "b": "tillaberi",
    "types": ["border", "road"], "capacity": 0.5,
    "notes": "Eastern Burkina–western Niger axis." },
  { "id": "tillaberi_niamey", "a": "tillaberi", "b": "niamey",
    "types": ["road"], "capacity": 0.75,
    "notes": "The capital sits inside its most contested region's commute." },
  { "id": "niamey_tahoua", "a": "niamey", "b": "tahoua",
    "types": ["road"], "capacity": 0.65,
    "notes": "Eastward national road." },
  { "id": "tillaberi_tahoua", "a": "tillaberi", "b": "tahoua",
    "types": ["road", "smuggling"], "capacity": 0.5,
    "notes": "Northern parallel route." },
  { "id": "tahoua_diffa", "a": "tahoua", "b": "diffa",
    "types": ["road", "smuggling"], "capacity": 0.4,
    "notes": "The long east road — two fronts, one thin line between them." },
  { "id": "ouagadougou_coastal", "a": "ouagadougou", "b": "coastal_north",
    "types": ["border", "road"], "capacity": 0.55,
    "notes": "South toward the Gulf littoral — the spillover everyone said was coming, and then it came." },
  { "id": "coastal_niamey", "a": "coastal_north", "b": "niamey",
    "types": ["border", "road"], "capacity": 0.45,
    "notes": "Benin–Niger border axis." }
]
